{
  "$schema": "https://json-schema.org/draft/2020-12/schema",
  "$id": "coq/events/schema/event.schema.json",
  "title": "event",
  "description": "One important event, one file, written only by events/bin/event.sh. No prose between agents: a code, who, what ticket, evidence paths, observations.",
  "type": "object", "additionalProperties": false,
  "required": ["schema_version", "id", "at", "code", "seat", "kind"],
  "properties": {
    "schema_version": { "const": "1.0.0" },
    "id": { "type": "string", "pattern": "^[0-9]{8}T[0-9]{6}Z-[0-9]{3}-[a-z0-9]{5}$" },
    "at": { "type": "string", "pattern": "^[0-9]{4}-[0-9]{2}-[0-9]{2}T[0-9]{2}:[0-9]{2}:[0-9]{2}Z$" },
    "code": { "enum": [100, 200, 201, 204, 300, 400, 409, 412, 422, 423, 429, 500, 503], "description": "the SPEC-17 s-codes status code map and nothing else; the writer reads this list, so adding a code is a row in the spec, a routes row, an entry here, and a lint check" },
    "seat": { "type": "string", "pattern": "^[a-z][a-z0-9_-]{0,31}$" },
    "kind": { "enum": ["seat.up", "seat.down", "seat.stalled", "gate", "test", "review", "merge", "deploy", "compaction", "blocked", "escalation", "note", "request.forwarded", "request.accepted", "request.rejected", "ticket.cut", "work.started", "pr.opened", "test.passed", "test.failed", "review.passed", "review.changes", "merged", "merge.conflict", "verified", "rejected", "escalated", "record.routed", "break.glass", "policy.applied", "line.halted", "line.draining", "line.resumed"] },
    "ticket": { "type": ["string", "null"], "pattern": "^WO-[0-9]{8}-[0-9a-f]{4}$" },
    "pane": { "type": ["string", "null"] },
    "to": { "enum": ["interface-agent", "orchestrator", "architect", "worker", "tester", "reviewer", "merger", "player", "monitor"], "description": "addressee role of a routed or escalated record; optional" },
    "note": { "type": "string", "maxLength": 240 },
    "evidence": { "type": "array", "items": { "type": "string" }, "maxItems": 20 },
    "observations": { "type": "array", "maxItems": 5, "items": { "type": "object", "additionalProperties": false, "required": ["saw", "expected"], "properties": { "path": { "type": "string" }, "line": { "type": "integer" }, "saw": { "type": "string", "maxLength": 240 }, "expected": { "type": "string", "maxLength": 240 } } } },
    "attempt": { "type": "integer", "minimum": 1, "maximum": 3 },
    "sha": { "type": "string", "pattern": "^[0-9a-f]{7,40}$", "description": "the pull request head this record is about; routed on the wake line of a row that says with pr. The writer requires it on pr.opened, test.passed, test.failed, review.passed, review.changes, merged, merge.conflict, verified and rejected; the schema cannot, because records written before that rule have none" },
    "pr": { "type": "integer", "minimum": 1, "description": "the pull request number; routed on the wake line of a row that says with pr" },
    "action": { "type": "string", "minLength": 1, "maxLength": 240, "description": "break.glass only: the one command the owner is asked to allow, exactly as the seat will run it" },
    "answer": { "type": "string", "pattern": "^[0-9]{8}T[0-9]{6}Z-[0-9]{3}-[a-z0-9]{5}$", "description": "break.glass: the id of the 300 request, which is also the id of the owner's card on the bearings page. policy.applied: the id of the escalated record the default answers" },
    "policy": { "type": "string", "pattern": "^POL-[a-z0-9][a-z0-9-]{0,47}$", "description": "policy.applied only: the id of the factory/config/policies.json row whose default this record is" }
  }
}
