{
  "schema_version": "1.0.0",
  "id": "20261012T141004Z-500-pbt4a",
  "at": "2026-10-12T14:10:04Z",
  "code": 500,
  "seat": "route-runner",
  "kind": "note",
  "ticket": "WO-20261012-668a",
  "pane": null,
  "note": "no route for escalation 100, record 20261012T140957Z-100-ytlv9",
  "evidence": [],
  "observations": [],
  "to": "monitor"
}
