{
  "schema_version": "1.0.0",
  "id": "20261012T125948Z-300-rqj3j",
  "at": "2026-10-12T12:59:48Z",
  "code": 300,
  "seat": "route-runner",
  "kind": "record.routed",
  "ticket": "WO-20261011-4562",
  "pane": null,
  "note": "routed note 500 (20261012T125941Z-500-q9kyk): wake monitor",
  "evidence": [
    "events/2026/10/20261012T125941Z-500-q9kyk.json"
  ],
  "observations": [],
  "to": "monitor"
}
