{
  "schema_version": "1.0.0",
  "id": "20261012T021632Z-300-53trr",
  "at": "2026-10-12T02:16:32Z",
  "code": 300,
  "seat": "route-runner",
  "kind": "record.routed",
  "ticket": "WO-20261011-4562",
  "pane": null,
  "note": "routed note 500 (20261012T021620Z-500-em4f3): wake monitor",
  "evidence": [
    "events/2026/10/20261012T021620Z-500-em4f3.json"
  ],
  "observations": [],
  "to": "monitor"
}
