{
  "schema_version": "1.0.0",
  "id": "20261012T150900Z-201-96a2e",
  "at": "2026-10-12T15:09:00Z",
  "code": 201,
  "seat": "tester-wo-20261011-4db1",
  "kind": "test.passed",
  "ticket": "WO-20261011-4db1",
  "pane": "wD3:p1V",
  "note": "passed e28e19c: factory 15/15, herdr 16/16, exit 0 both",
  "evidence": [
    "/tmp/claude-1000/-home-luna--treehouse-coq-jev-herdr-plugin-f314e6-3-coq-jev-herdr-plugin/6d422f8b-3401-4ad2-aa70-37241e60182a/scratchpad/rerun-e28e19c.log"
  ],
  "observations": [],
  "attempt": 1,
  "to": "reviewer",
  "sha": "e28e19c",
  "pr": 21
}
