{
  "schema_version": "1.0.0",
  "id": "20261012T165944Z-100-7y6gq",
  "at": "2026-10-12T16:59:44Z",
  "code": 100,
  "seat": "reviewer-wo-20261012-b800",
  "kind": "seat.up",
  "ticket": "WO-20261012-b800",
  "pane": "wD3:pBQ",
  "note": "reviewer seat up: claude-sonnet-5-5 high bypassPermissions",
  "evidence": [],
  "observations": []
}
