{
  "schema_version": "1.0.0",
  "id": "20261012T163557Z-300-qjvub",
  "at": "2026-10-12T16:35:57Z",
  "code": 300,
  "seat": "route-runner",
  "kind": "record.routed",
  "ticket": "WO-20261012-da52",
  "pane": null,
  "note": "routed review.changes 422 (20261012T163536Z-422-3hdaj): escalate architect, down reviewer",
  "evidence": [
    "events/2026/10/20261012T163536Z-422-3hdaj.json"
  ],
  "observations": [],
  "to": "architect"
}
