{
  "schema_version": "1.0.0",
  "id": "20261012T171054Z-500-wxtvj",
  "at": "2026-10-12T17:10:54Z",
  "code": 500,
  "seat": "route-runner",
  "kind": "note",
  "ticket": "WO-20261011-ceea",
  "pane": null,
  "note": "no route for work.started 100, record 20261012T171041Z-100-69pwp",
  "evidence": [],
  "observations": [],
  "to": "monitor"
}
