{
  "schema_version": "1.0.0",
  "id": "20261012T161544Z-500-byxsc",
  "at": "2026-10-12T16:15:44Z",
  "code": 500,
  "seat": "flow-watch",
  "kind": "note",
  "ticket": "WO-20261012-b800",
  "pane": null,
  "note": "stall: pr.opened 100 20261012T161400Z-100-qv7rh has no tester record after 90s",
  "evidence": [],
  "observations": [],
  "to": "monitor"
}
