{
  "schema_version": "1.0.0",
  "id": "20261011T233922Z-500-61aru",
  "at": "2026-10-11T23:39:22Z",
  "code": 500,
  "seat": "route-runner",
  "kind": "note",
  "ticket": "WO-20261011-f896",
  "pane": null,
  "note": "no route for note 100, record 20261011T233915Z-100-6a03k",
  "evidence": [],
  "observations": [],
  "to": "monitor"
}
