{
  "schema_version": "1.0.0",
  "id": "20261011T154150Z-100-imqys",
  "at": "2026-10-11T15:41:50Z",
  "code": 100,
  "seat": "tester-wo-20261011-38c7",
  "kind": "seat.up",
  "ticket": "WO-20261011-38c7",
  "pane": "wD3:p1V",
  "note": "tester seat up: claude-haiku-5-5 medium bypassPermissions; test plan make -C factory test queued for PR 14",
  "evidence": [],
  "observations": []
}
