{
  "schema_version": "1.0.0",
  "id": "20261012T150953Z-422-yfyzp",
  "at": "2026-10-12T15:09:53Z",
  "code": 422,
  "seat": "tester-wo-20261011-ceea",
  "kind": "test.failed",
  "ticket": "WO-20261011-ceea",
  "pane": "wD3:p70",
  "note": "932863e: make -C report/loop test 15 passed 1 failed (08-graph). Cause is tester record kccii (null observation fields), not the worker code. da1is gone.",
  "evidence": [
    "/tmp/claude-1000/-home-luna--treehouse-coq-jev-herdr-plugin-f314e6-4-coq-jev-herdr-plugin/f024489a-4efa-4d2c-b0b9-529b0415ac54/scratchpad/tester-ceea-loop-test-932863e.log"
  ],
  "observations": [],
  "attempt": 2,
  "to": "worker"
}
