{
  "schema_version": "1.0.0",
  "id": "20261012T165137Z-100-xhdlh",
  "at": "2026-10-12T16:51:37Z",
  "code": 100,
  "seat": "monitor",
  "kind": "escalation",
  "ticket": "WO-20261012-8fb2",
  "pane": null,
  "note": "owner notified for 500 4y9mf: pr.opened h4kag has no tester record after 90s; tester-wo-20261012-8fb2 prompted",
  "evidence": [],
  "observations": [],
  "to": "tester"
}
