{
  "schema_version": "1.0.0",
  "id": "20261012T152239Z-423-9gyg8",
  "at": "2026-10-12T15:22:39Z",
  "code": 423,
  "seat": "route-runner",
  "kind": "escalated",
  "ticket": "WO-20261012-72a0",
  "pane": null,
  "note": "escalated record 20261012T152225Z-423-s8cgf",
  "evidence": [],
  "observations": [],
  "to": "architect"
}
