{
  "schema_version": "1.0.0",
  "id": "20261011T233801Z-500-t8zbr",
  "at": "2026-10-11T23:38:01Z",
  "code": 500,
  "seat": "route-runner",
  "kind": "note",
  "ticket": "WO-20261011-4562",
  "pane": null,
  "note": "no route for note 100, record 20261011T233749Z-100-f285q",
  "evidence": [],
  "observations": [],
  "to": "monitor"
}
