{
  "schema_version": "1.0.0",
  "id": "20261012T170020Z-500-e47pe",
  "at": "2026-10-12T17:00:20Z",
  "code": 500,
  "seat": "route-runner",
  "kind": "note",
  "ticket": "WO-20261012-c41f",
  "pane": null,
  "note": "no route for note 429, record 20261012T165946Z-429-vu42s",
  "evidence": [],
  "observations": [],
  "to": "monitor"
}
