{
  "schema_version": "1.0.0",
  "id": "20261011T201733Z-100-u4kmy",
  "at": "2026-10-11T20:17:33Z",
  "code": 100,
  "seat": "architect",
  "kind": "note",
  "ticket": "WO-20261011-616c",
  "pane": "wD3:p2",
  "note": "slot 2 untracked records preserved into the checkout events and cleared (git status clean); tester-wo-20261011-616c holds the lease and returns the slot after you; post merged 200 and run seat.sh --down merger without the slot return",
  "evidence": [],
  "observations": [],
  "to": "merger"
}
